B1: Animal | C1: Tetris | D1: Spy | E1: Juice | F1: Secret | G1: Inside | H1: 합계
A2: 조용운 | B2: 0 | C2: 20 | D2: 100 | E2: 100 | F2: 30 | G2: 100 | H2: =SUM(B2:G2) -> 350
A3: 여윤동 | B3: 30 | C3: 0 | D3: 20 | E3: 100 | F3: 30 | G3: 100 | H3: =SUM(B3:G3) -> 280
A4: 박준영 | B4: 30 | C4: 0 | D4: 40 | E4: 100 | F4: 0 | G4: 100 | H4: =SUM(B4:G4) -> 270
A5: 류원하 | B5: 30 | C5: 0 | D5: 40 | E5: 100 | F5: 0 | G5: 100 | H5: =SUM(B5:G5) -> 270
A6: 신재유 | B6: 0 | C6: 20 | D6: 40 | E6: 100 | F6: 10 | G6: 100 | H6: =SUM(B6:G6) -> 270
A7: 강병진 | B7: 20 | C7: 20 | D7: 20 | E7: 100 | F7: 0 | G7: 100 | H7: =SUM(B7:G7) -> 260
A8: 김선필 | B8: 30 | C8: 70 | D8: 0 | E8: 60 | F8: 0 | G8: 100 | H8: =SUM(B8:G8) -> 260
A9: 김영효 | B9: 30 | C9: 10 | D9: 0 | E9: 60 | F9: 10 | G9: 100 | H9: =SUM(B9:G9) -> 210
A10: 김이루 | B10: 20 | C10: 20 | D10: 40 | E10: 100 | F10: 0 | G10: 0 | H10: =SUM(B10:G10) -> 180
A11: 안일규 | B11: 0 | C11: 0 | D11: 0 | E11: 60 | F11: 20 | G11: 100 | H11: =SUM(B11:G11) -> 180
A12: 오승규 | B12: 30 | C12: 0 | D12: 0 | E12: 100 | F12: 20 | G12: 0 | H12: =SUM(B12:G12) -> 150
A13: 허신영 | B13: 0 | C13: 0 | D13: 20 | E13: 0 | F13: 20 | G13: 100 | H13: =SUM(B13:G13) -> 140
A14: 김종균 | B14: 20 | C14: 0 | D14: 0 | E14: 100 | F14: 0 | G14: 0 | H14: =SUM(B14:G14) -> 120
A15: 김민준 | B15: 30 | C15: 20 | D15: 0 | E15: 0 | F15: 0 | G15: 0 | H15: =SUM(B15:G15) -> 50
A16: 김영호 | B16: 0 | C16: 0 | D16: 20 | E16: 0 | F16: 0 | G16: 0 | H16: =SUM(B16:G16) -> 20
A17: 유원석 | B17: 0 | C17: 0 | D17: 20 | E17: 0 | F17: 0 | G17: 0 | H17: =SUM(B17:G17) -> 20
A18: 김채린 | B18: 0 | C18: 0 | D18: 20 | E18: 0 | F18: 0 | G18: 0 | H18: =SUM(B18:G18) -> 20
A20: Dream
A21: 김기형 | B21: 0 | C21: 0 | D21: 0 | E21: 0 | F21: 0 | G21: 0 | H21: =SUM(B21:G21) -> 0
A22: 이도경 | B22: 0 | C22: 0 | D22: 0 | E22: 0 | F22: 0 | G22: 0 | H22: =SUM(B22:G22) -> 0
A23: 허신영 | B23: 0 | C23: 0 | D23: 20 | E23: 0 | F23: 20 | G23: 100 | H23: =SUM(B23:G23) -> 140
A24: 류원하 | B24: 30 | C24: 0 | D24: 40 | E24: 100 | F24: 0 | G24: 100 | H24: =SUM(B24:G24) -> 270
A25: 김종균 | B25: 20 | C25: 0 | D25: 0 | E25: 100 | F25: 0 | G25: 0 | H25: =SUM(B25:G25) -> 120 | I25: =SUM(H21:H25) -> 530
A27: Eagle
A28: 강병진 | B28: 20 | C28: 20 | D28: 20 | E28: 100 | F28: 0 | G28: 100 | H28: =SUM(B28:G28) -> 260
A29: 조용운 | B29: 0 | C29: 20 | D29: 100 | E29: 100 | F29: 30 | G29: 100 | H29: =SUM(B29:G29) -> 350
A30: 김이루 | B30: 20 | C30: 20 | D30: 40 | E30: 100 | F30: 0 | G30: 0 | H30: =SUM(B30:G30) -> 180
A31: 김선필 | B31: 30 | C31: 70 | D31: 0 | E31: 60 | F31: 0 | G31: 100 | H31: =SUM(B31:G31) -> 260
A32: 신재유 | B32: 0 | C32: 20 | D32: 40 | E32: 100 | F32: 10 | G32: 100 | H32: =SUM(B32:G32) -> 270 | I32: =SUM(H28:H32) -> 1320
A34: World
A35: 여윤동 | B35: 30 | C35: 0 | D35: 20 | E35: 100 | F35: 30 | G35: 100 | H35: =SUM(B35:G35) -> 280
A36: 조형문 | B36: 0 | C36: 0 | D36: 0 | E36: 0 | F36: 0 | G36: 0 | H36: =SUM(B36:G36) -> 0
A37: 박준영 | B37: 30 | C37: 0 | D37: 40 | E37: 100 | F37: 0 | G37: 100 | H37: =SUM(B37:G37) -> 270
A38: 김영효 | B38: 30 | C38: 10 | D38: 0 | E38: 60 | F38: 10 | G38: 100 | H38: =SUM(B38:G38) -> 210
A39: 문상우 | B39: 0 | C39: 0 | D39: 0 | E39: 0 | F39: 0 | G39: 0 | H39: 0 | I39: =SUM(H35:H40) -> 760
A42: 외인구단
A43: 김영호 | B43: 0 | C43: 0 | D43: 20 | E43: 0 | F43: 0 | G43: 0 | H43: =SUM(B43:G43) -> 20
A44: 유원석 | B44: 0 | C44: 0 | D44: 20 | E44: 0 | F44: 0 | G44: 0 | H44: =SUM(B44:G44) -> 20
A45: 안일규 | B45: 0 | C45: 0 | D45: 0 | E45: 60 | F45: 20 | G45: 100 | H45: =SUM(B45:G45) -> 180
A46: 김민준 | B46: 30 | C46: 20 | D46: 0 | E46: 0 | F46: 0 | G46: 0 | H46: =SUM(B46:G46) -> 50 | I46: =SUM(H41:H46) -> 270
A47: 오승규 | B47: 30 | C47: 0 | D47: 0 | E47: 100 | F47: 20 | G47: 0 | H47: =SUM(B47:G47) -> 150
A48: 김채린 | B48: 0 | C48: 0 | D48: 20 | E48: 0 | F48: 0 | G48: 0 | H48: =SUM(B48:G48) -> 20