B1: 강남월드 2002 겨울 캠프 전체 성적
B2: (기간:02.12.31-03.01.10)
A3: 등수 | B3: 이름 | C3: 31일 | D3: 1일 | E3: 2일 | F3: 3일 | G3: 4일 | H3: 5일 | I3: 6일 | J3: 7일 | K3: 8일 | L3: 9일 | M3: 모의고사 | N3: 총합
A4: 1 | B4: 김영효 | C4: 210 | D4: 397 | E4: 420 | F4: 364 | G4: 450 | H4: 243 | I4: 230 | J4: 200 | K4: 310 | L4: 290 | M4: 108 | N4: =SUM(C4:M4) -> 3222
A5: =+A4+1 -> 2 | B5: 이도경 | C5: 150 | D5: 410 | E5: 350 | F5: 370 | G5: 250 | H5: 170 | I5: 278 | J5: 247 | K5: 350 | L5: 290 | M5: 58 | N5: =SUM(C5:M5) -> 2923
A6: =+A5+1 -> 3 | B6: 박종우 | C6: 110 | D6: 472 | E6: 352 | F6: 346 | G6: 310 | H6: 250 | I6: 243 | J6: 100 | K6: 223 | L6: 100 | M6: 148 | N6: =SUM(C6:M6) -> 2654
A7: =+A6+1 -> 4 | B7: 강지훈 | C7: 190 | D7: 430 | E7: 295 | F7: 498 | G7: 300 | H7: 199 | I7: 130 | J7: 57 | K7: 220 | L7: 200 | M7: 121 | N7: =SUM(C7:M7) -> 2640
A8: =+A7+1 -> 5 | B8: 신재유 | C8: 50 | D8: 353 | E8: 268 | F8: 338 | G8: 350 | H8: 190 | I8: 137 | J8: 240 | K8: 210 | L8: 260 | M8: 123 | N8: =SUM(C8:M8) -> 2519
A9: =+A8+1 -> 6 | B9: 류원하 | C9: 80 | D9: 465 | E9: 314 | F9: 206 | G9: 390 | H9: 177 | I9: 133 | J9: 200 | K9: 140 | L9: 300 | M9: 100 | N9: =SUM(C9:M9) -> 2505
A10: =+A9+1 -> 7 | B10: 김기형 | C10: 70 | D10: 353 | E10: 220 | F10: 296 | G10: 210 | H10: 250 | I10: 146 | J10: 87 | K10: 370 | L10: 180 | M10: 148 | N10: =SUM(C10:M10) -> 2330
A11: =+A10+1 -> 8 | B11: 최현웅 | C11: 140 | D11: 412 | E11: 300 | F11: 397 | G11: 160 | H11: 130 | I11: 160 | J11: 40 | K11: 210 | L11: 190 | M11: 138 | N11: =SUM(C11:M11) -> 2277
A12: =+A11+1 -> 9 | B12: 강병진 | C12: 140 | D12: 455 | E12: 323 | F12: 331 | G12: 160 | H12: 200 | I12: 120 | J12: 20 | K12: 133 | L12: 120 | M12: 143 | N12: =SUM(C12:M12) -> 2145
A13: =+A12+1 -> 10 | B13: 서준석 | C13: 140 | D13: 442 | E13: 300 | F13: 310 | G13: 190 | H13: 279 | I13: 40 | J13: 160 | K13: 120 | L13: 110 | M13: 50 | N13: =SUM(C13:M13) -> 2141
A14: =+A13+1 -> 11 | B14: 허신영 | C14: 140 | D14: 380 | E14: 265 | F14: 316 | G14: 170 | H14: ---- | I14: 153 | J14: 57 | K14: 240 | L14: 190 | M14: 100 | N14: =SUM(C14:M14) -> 2011
A15: =+A14+1 -> 12 | B15: 여윤동 | C15: 120 | D15: 510 | E15: 400 | F15: 338 | G15: 230 | H15: 271 | I15: ---- | J15: ---- | K15: ---- | L15: ---- | M15: ---- | N15: =SUM(C15:M15) -> 1869
A16: =+A15+1 -> 13 | B16: 안일규 | C16: 130 | D16: 330 | E16: 250 | F16: 266 | G16: 70 | H16: 210 | I16: 83 | J16: 100 | K16: 150 | L16: 100 | M16: 113 | N16: =SUM(C16:M16) -> 1802
A17: =+A16+1 -> 14 | B17: 오신행 | C17: 40 | D17: 270 | E17: 301 | F17: 277 | G17: 110 | H17: 223 | I17: 183 | J17: 197 | K17: 20 | L17: 100 | M17: 50 | N17: =SUM(C17:M17) -> 1771
A18: =+A17+1 -> 15 | B18: 김재원 | C18: 140 | D18: 355 | E18: 315 | F18: 236 | G18: 160 | H18: 80 | I18: 155 | J18: 71 | K18: 0 | L18: 100 | M18: 38 | N18: =SUM(C18:M18) -> 1650
A19: =+A18+1 -> 16 | B19: 김민준 | C19: ---- | D19: ---- | E19: ---- | F19: 346 | G19: 220 | H19: 224 | I19: 82 | J19: 144 | K19: 240 | L19: 190 | M19: 130 | N19: =SUM(C19:M19) -> 1576
A20: =+A19+1 -> 17 | B20: 권성태 | C20: 180 | D20: 490 | E20: 431 | F20: 391 | G20: ---- | H20: ---- | I20: --- | J20: --- | K20: ---- | L20: ---- | M20: ---- | N20: =SUM(C20:M20) -> 1492
A21: =+A20+1 -> 18 | B21: 최찬영 | C21: 100 | D21: 195 | E21: 167 | F21: 191 | G21: 150 | H21: 120 | I21: 68 | J21: 89 | K21: 150 | L21: 110 | M21: 19 | N21: =SUM(C21:M21) -> 1359
A22: =+A21+1 -> 19 | B22: 차준범 | C22: 100 | D22: 260 | E22: 308 | F22: 0 | G22: 110 | H22: 210 | I22: ---- | J22: 0 | K22: 220 | L22: 0 | M22: 75 | N22: =SUM(C22:M22) -> 1283
A23: =+A22+1 -> 20 | B23: 문상우 | C23: 30 | D23: 88 | E23: 160 | F23: 221 | G23: 210 | H23: 257 | I23: 148 | J23: 97 | K23: 0 | L23: 0 | M23: 31 | N23: =SUM(C23:M23) -> 1242
A24: =+A23+1 -> 21 | B24: 김선필 | C24: 130 | D24: 380 | E24: 191 | F24: 211 | G24: 210 | H24: 80 | I24: --- | J24: --- | K24: ---- | L24: ---- | M24: ---- | N24: =SUM(C24:M24) -> 1202
A25: =+A24+1 -> 22 | B25: 김종균 | C25: 30 | D25: 433 | E25: 218 | F25: 176 | G25: 170 | H25: ---- | I25: --- | J25: --- | K25: ---- | L25: ---- | M25: ---- | N25: =SUM(C25:M25) -> 1027
A26: =+A25+1 -> 23 | B26: 김재주 | C26: ---- | D26: ---- | E26: 0 | F26: 100 | G26: 110 | H26: 190 | I26: 20 | J26: 160 | K26: 100 | L26: 130 | M26: 38 | N26: =SUM(C26:M26) -> 848
A27: =+A26+1 -> 24 | B27: 공영인 | C27: ---- | D27: ---- | E27: 107 | F27: 173 | G27: 10 | H27: 100 | I27: 80 | J27: 0 | K27: 130 | L27: 70 | M27: 0 | N27: =SUM(C27:M27) -> 670
A28: =+A27+1 -> 25 | B28: 홍대영 | C28: ---- | D28: ---- | E28: ---- | F28: ---- | G28: ---- | H28: 80 | I28: 158 | J28: 146 | K28: 228 | L28: 30 | M28: 0 | N28: =SUM(C28:M28) -> 642
A29: =+A28+1 -> 26 | B29: 가석현 | C29: ---- | D29: ---- | E29: ---- | F29: ---- | G29: 60 | H29: 144 | I29: 98 | J29: 0 | K29: 80 | L29: 20 | M29: 125 | N29: =SUM(C29:M29) -> 527
A30: =+A29+1 -> 27 | B30: 김수인 | C30: ---- | D30: ---- | E30: ---- | F30: ---- | G30: ---- | H30: 100 | I30: 68 | J30: 0 | K30: 170 | L30: 120 | M30: 13 | N30: =SUM(C30:M30) -> 471
A31: =+A30+1 -> 28 | B31: 한상호 | C31: ---- | D31: ---- | E31: ---- | F31: ---- | G31: ---- | H31: 110 | I31: 78 | J31: 20 | K31: 40 | L31: 160 | M31: 50 | N31: =SUM(C31:M31) -> 458
A32: =+A31+1 -> 29 | B32: 강대원 | C32: ---- | D32: ---- | E32: ---- | F32: ---- | G32: ---- | H32: 150 | I32: 20 | J32: 60 | K32: 60 | L32: 100 | M32: 63 | N32: =SUM(C32:M32) -> 453
A33: =+A32+1 -> 30 | B33: 김채린 | C33: ---- | D33: ---- | E33: 100 | F33: ---- | G33: 40 | H33: ---- | I33: --- | J33: --- | K33: 200 | L33: 70 | M33: 0 | N33: =SUM(C33:M33) -> 410
A34: =+A33+1 -> 31 | B34: 윤재필 | C34: ---- | D34: ---- | E34: ---- | F34: ---- | G34: ---- | H34: ---- | I34: 33 | J34: 0 | K34: 208 | L34: 70 | M34: 76 | N34: =SUM(C34:M34) -> 387
A35: =+A34+1 -> 32 | B35: 김세환 | C35: ---- | D35: ---- | E35: ---- | F35: ---- | G35: ---- | H35: ---- | I35: ---- | J35: 0 | K35: 210 | L35: 60 | M35: 100 | N35: =SUM(C35:M35) -> 370
A36: =+A35+1 -> 33 | B36: 강동진 | C36: ---- | D36: ---- | E36: ---- | F36: ---- | G36: ---- | H36: ---- | I36: ---- | J36: ---- | K36: 120 | L36: 120 | M36: 13 | N36: =SUM(C36:M36) -> 253
A37: =+A36+1 -> 34 | B37: 이요셉 | C37: ---- | D37: ---- | E37: ---- | F37: ---- | G37: ---- | H37: ---- | I37: ---- | J37: ---- | K37: 108 | L37: 100 | M37: 26 | N37: =SUM(C37:M37) -> 234
A38: =+A37+1 -> 35 | B38: 이상욱 | C38: ---- | D38: ---- | E38: ---- | F38: ---- | G38: ---- | H38: 200 | I38: ---- | J38: ---- | K38: ---- | L38: ---- | M38: 0 | N38: =SUM(C38:M38) -> 200
A39: =+A38+1 -> 36 | B39: 김성율 | C39: ---- | D39: ---- | E39: ---- | F39: ---- | G39: ---- | H39: ---- | I39: ---- | J39: 0 | K39: 130 | L39: 0 | M39: 0 | N39: =SUM(C39:M39) -> 130
A40: =+A39+1 -> 37 | B40: 정효현 | C40: ---- | D40: ---- | E40: ---- | F40: ---- | G40: ---- | H40: ---- | I40: ---- | J40: ---- | K40: 10 | L40: 100 | M40: 0 | N40: =SUM(C40:M40) -> 110
A41: =+A40+1 -> 38 | B41: 윤종흔 | C41: ---- | D41: ---- | E41: ---- | F41: ---- | G41: ---- | H41: 100 | I41: ---- | J41: ---- | K41: ---- | L41: ---- | M41: --- | N41: =SUM(C41:M41) -> 100
A42: =+A41+1 -> 39 | B42: 김상연 | C42: ---- | D42: ---- | E42: ---- | F42: ---- | G42: ---- | H42: 10 | I42: --- | J42: 0 | K42: 0 | L42: 0 | M42: 0 | N42: =SUM(C42:M42) -> 10