B1: 1월 5일 채점 결과
C3: ancestors | D3: grid | E3: urvi | F3: recircle | G3: rectsum | H3: leaves | I3: 합계
A4: 1 | B4: 서준석 | C4: 100 | D4: 20 | E4: 40 | F4: 29 | G4: 50 | I4: =SUM(C4:H4) -> 239
A5: =A4+1 -> 2 | B5: 여윤동 | C5: 100 | D5: 0 | F5: 71 | G5: 50 | I5: =SUM(C5:H5) -> 221
A6: =A5+1 -> 3 | B6: 김기형 | C6: 100 | D6: 20 | E6: 0 | F6: 100 | G6: 0 | I6: =SUM(C6:H6) -> 220
A7: =A6+1 -> 4 | B7: 김영효 | C7: 100 | D7: 20 | E7: 20 | F7: 43 | G7: 30 | I7: =SUM(C7:H7) -> 213
A8: =A7+1 -> 5 | B8: 문상우 | C8: 100 | D8: 10 | F8: 57 | G8: 40 | I8: =SUM(C8:H8) -> 207
A9: =A8+1 -> 6 | B9: 박종우 | C9: 100 | D9: 10 | E9: 40 | G9: 50 | I9: =SUM(C9:H9) -> 200
A10: =A9+1 -> 7 | B10: 오신행 | C10: 100 | D10: 0 | F10: 43 | G10: 40 | I10: =SUM(C10:H10) -> 183
A11: =A10+1 -> 8 | B11: 류원하 | C11: 100 | D11: 0 | F11: 57 | G11: 20 | I11: =SUM(C11:H11) -> 177
A12: =A11+1 -> 9 | B12: 김민준 | C12: 100 | D12: 20 | F12: 14 | G12: 40 | I12: =SUM(C12:H12) -> 174
A13: =A12+1 -> 10 | B13: 안일규 | C13: 100 | D13: 10 | E13: 20 | F13: 0 | G13: 40 | I13: =SUM(C13:H13) -> 170
A14: =A13+1 -> 11 | B14: 차준범 | C14: 100 | D14: 30 | F14: 0 | G14: 40 | I14: =SUM(C14:H14) -> 170
A15: =A14+1 -> 12 | B15: 강병진 | C15: 100 | D15: 20 | G15: 40 | I15: =SUM(C15:H15) -> 160
A16: =A15+1 -> 13 | B16: 이상욱 | C16: 100 | D16: 10 | F16: 0 | G16: 40 | I16: =SUM(C16:H16) -> 150
A17: =A16+1 -> 14 | B17: 강지훈 | C17: 70 | F17: 29 | G17: 50 | I17: =SUM(C17:H17) -> 149
A18: =A17+1 -> 15 | B18: 김재주 | C18: 100 | D18: 0 | G18: 40 | I18: =SUM(C18:H18) -> 140
A19: =A18+1 -> 16 | B19: 신재유 | C19: 70 | D19: 10 | E19: 10 | F19: 0 | G19: 50 | I19: =SUM(C19:H19) -> 140
A20: =A19+1 -> 17 | B20: 이도경 | C20: 90 | D20: 10 | F20: 0 | G20: 30 | I20: =SUM(C20:H20) -> 130
A21: =A20+1 -> 18 | B21: 최현웅 | C21: 100 | D21: 0 | E21: 30 | G21: 0 | I21: =SUM(C21:H21) -> 130
A22: =A21+1 -> 19 | B22: 강대원 | C22: 70 | D22: 0 | G22: 30 | I22: =SUM(C22:H22) -> 100
A23: =A22+1 -> 20 | B23: 김수인 | C23: 100 | G23: 0 | I23: =SUM(C23:H23) -> 100
A24: =A23+1 -> 21 | B24: 윤종흔 | C24: 100 | F24: 0 | I24: =SUM(C24:H24) -> 100
A25: =A24+1 -> 22 | B25: 가석현 | C25: 30 | D25: 10 | F25: 14 | G25: 40 | I25: =SUM(C25:H25) -> 94
A26: =A25+1 -> 23 | B26: 최찬영 | C26: 60 | D26: 0 | E26: 10 | G26: 20 | I26: =SUM(C26:H26) -> 90
A27: =A26+1 -> 24 | B27: 홍대영 | C27: 70 | D27: 10 | G27: 0 | I27: =SUM(C27:H27) -> 80
A28: =A27+1 -> 25 | B28: 한상호 | C28: 0 | D28: 10 | E28: 10 | G28: 40 | I28: =SUM(C28:H28) -> 60
A29: =A28+1 -> 26 | B29: 공영인 | G29: 50 | I29: =SUM(C29:H29) -> 50
A30: =A29+1 -> 27 | B30: 김선필 | C30: 0 | G30: 40 | I30: =SUM(C30:H30) -> 40
A31: =A30+1 -> 28 | B31: 김재원 | C31: 0 | D31: 0 | F31: 0 | G31: 40 | I31: =SUM(C31:H31) -> 40
A32: =A31+1 -> 29 | B32: 김상연 | C32: 0 | G32: 0 | I32: =SUM(C32:H32) -> 0
A33: =A32+1 -> 30 | B33: 김종균 | I33: =SUM(C33:H33) -> 0
A34: =A33+1 -> 31 | B34: 김채린 | I34: =SUM(C34:H34) -> 0
A35: =A34+1 -> 32 | B35: 허신영 | I35: =SUM(C35:H35) -> 0
B37: 일등조 -> 야인 | C37: Dream
B39: World | C39: 김영효, 문상우, 서준석, 강병진, 차준범, 김채린, 공영인 | I39: 921
B40: Dream | C40: 신재유, 이도경, 김기형, 김재원, 최현웅, 가석현 | I40: 770
B41: Eagle | C41: 류원하, 여윤동, 김종균, 김선필, 김재주, 안일규 | I41: 784
B42: 야인 | C42: 박종우, 강지훈, 허신영, 김민준, 오신행, 최찬영 | I42: 712
B44: 내일의 조
B45: World | C45: 서준석, 김민준, 안일규, 이도경, 최현웅, 한상호, 공영인,
B46: Dream | C46: 오신행, 류원하, 차준범, 신재유, 강대원, 홍대영, 허신영
B47: Eagle | C47: 김기형, 박종우, 강병진, 김재주, 김수인, 최찬영, 김재원,
B48: 야인 | C48: 김영효, 문상우, 이상욱, 강지훈, 윤종흔, 가석현, 김상연, 김채린